grant_id,funding.agency,funding.amount,date.start,date.end,title,abstract
100173,ABC,735000,9/29/2011,9/26/2012,In eget eros at augue semper malesuada a quis quam.,"Duis rutrum cursus urna vitae venenatis. Cras quis justo a libero dapibus semper consequat id risus. Nunc vitae neque nulla, dictum mollis odio. Aliquam erat volutpat. Suspendisse malesuada metus nec sem aliquet eget euismod sem condimentum. Sed pulvinar dui vel sapien ultrices eu sagittis massa convallis. Ut eget sapien quis tellus pulvinar tincidunt eget quis mi. Cras ac arcu dui, bibendum consequat est. Suspendisse lacinia enim ac metus auctor at ultricies lacus faucibus. Donec quis justo metus. Suspendisse lacinia, est vel congue malesuada, quam libero imperdiet dui, a iaculis tellus eros vitae ante."
100174,DDD,696000,11/7/2011,10/8/2012,"In eu arcu sapien, vel placerat lacus.","Mauris dignissim, nibh in suscipit dictum, mauris tellus placerat libero, id auctor massa eros in dolor. Vestibulum ante ipsum primis in faucibus orci luctus et ultrices posuere cubilia Curae; Morbi id lacus pretium risus varius ultricies sollicitudin ut ante. Phasellus imperdiet, diam non dictum euismod, felis massa pharetra sem, ut hendrerit nulla urna in orci. Integer porttitor tellus at arcu vestibulum eget sagittis risus pellentesque. Maecenas ultricies turpis et diam accumsan a aliquet elit tempus. Nullam arcu est, egestas ut adipiscing feugiat, convallis ac nulla. Maecenas pellentesque eleifend velit id porttitor. In condimentum tincidunt magna et tristique. Class aptent taciti sociosqu ad litora torquent per conubia nostra, per inceptos himenaeos. Praesent at velit nisl, non accumsan odio. Donec pellentesque velit eu erat malesuada tristique. Donec nisl elit, gravida in placerat sit amet, faucibus vel libero. Pellentesque sit amet purus ac ligula aliquet lacinia vitae quis ligula. Praesent a consequat risus. Morbi eget lacus ac justo dictum tincidunt."
100175,NSF,735000,11/16/2011,10/19/2012,"In eu ipsum tortor, vitae dignissim massa.","Donec vel nisl nulla. Etiam nec orci orci, et vulputate sem. Sed ac sem vel lacus tincidunt dignissim non vel diam. Nam turpis lectus, bibendum ut varius id, viverra ac dolor. Morbi nec tortor erat. Aliquam hendrerit dui pharetra ipsum malesuada eu sollicitudin erat rutrum. Integer ac posuere tortor. Integer congue purus sit amet nunc consequat lacinia lacinia elit molestie. Duis facilisis blandit turpis quis interdum. Curabitur semper ullamcorper semper. Integer quam dolor, venenatis quis vehicula sit amet, feugiat a quam. Mauris viverra mi ut elit pellentesque commodo sed ac tellus."
100176,BBB,206000,6/28/2011,11/5/2012,In euismod elit vitae dui congue quis porttitor diam dignissim.,"Nulla sagittis commodo laoreet. Cras scelerisque placerat arcu sit amet ullamcorper. Integer fermentum tellus id nulla dignissim auctor. Suspendisse porttitor libero a justo blandit sagittis. Donec scelerisque bibendum turpis id condimentum. Pellentesque at erat quis ligula auctor dignissim varius sed est. Aliquam egestas ipsum eget tortor tincidunt vulputate. Nunc et massa lectus, eu sollicitudin dui. Etiam semper velit eget nibh fringilla vehicula sollicitudin massa rhoncus. Vivamus eu risus eu nisi dictum iaculis."
100177,DDD,655000,8/4/2011,11/20/2012,"In fringilla luctus justo, vitae dapibus urna ultrices id.","Maecenas sed leo eros, ac fringilla elit. Duis sit amet pretium nulla. Vivamus lacinia vehicula nisl, vel sagittis purus ullamcorper id. Nam vehicula egestas mollis. Integer sed erat vitae leo laoreet volutpat. Donec sodales tempor ultrices. Lorem ipsum dolor sit amet, consectetur adipiscing elit. Cum sociis natoque penatibus et magnis dis parturient montes, nascetur ridiculus mus. Etiam turpis diam, porttitor at sodales eget, elementum quis risus. Pellentesque dui leo, mattis vitae mattis at, vestibulum ut eros. Morbi a elementum sapien. Ut vel sapien quis metus luctus tristique sed non nisi."
100178,EFG,962000,8/19/2011,11/30/2012,In hendrerit massa vel neque ornare ac aliquam risus tincidunt.,"Proin viverra accumsan condimentum. Nulla ut purus tortor. Donec dignissim cursus hendrerit. Quisque mi elit, blandit id dignissim quis, interdum quis magna. Duis condimentum consectetur hendrerit. Suspendisse nec condimentum ligula. Nulla massa diam, venenatis eget volutpat id, volutpat vel nibh. Nunc quis elit ac massa auctor faucibus. Integer nulla mi, laoreet eget vehicula et, blandit ut nunc. Nulla leo augue, sodales a auctor eu, commodo vitae arcu. Donec consequat, velit id sollicitudin dictum, mauris dolor adipiscing dolor, vitae mollis libero sem sit amet nisi."
100179,Dept of Education,455000,9/29/2011,12/27/2012,In id leo eget orci feugiat fermentum ut sed erat.,"Mauris vitae ante ut lectus semper condimentum non nec lacus. Nunc a consectetur erat. Suspendisse lobortis venenatis arcu quis semper. Fusce id augue ante. Curabitur diam justo, varius eget tempor vitae, consectetur lacinia elit. In quis leo sit amet justo tempor molestie. Sed convallis iaculis nibh posuere pulvinar. Maecenas tincidunt augue eget ante dapibus sit amet sodales lectus suscipit. In quam velit, lacinia et pellentesque id, ultrices pulvinar nunc. Etiam malesuada eros sed purus ullamcorper elementum. In feugiat faucibus condimentum. Nullam sodales, massa quis mattis malesuada, neque orci dictum purus, in mattis odio metus id neque. Ut et lorem diam. Pellentesque metus libero, fringilla vitae imperdiet at, commodo quis quam. Duis adipiscing sem aliquet lorem pharetra convallis."
100180,BBB,315000,11/7/2011,2/28/2013,In interdum quam in turpis rhoncus rhoncus.,"Fusce malesuada fermentum rutrum. Vestibulum ac turpis quis quam aliquet suscipit sed a tortor. In hac habitasse platea dictumst. Nunc dictum egestas mauris at consectetur. Phasellus lectus urna, gravida vitae egestas quis, auctor ut erat. Donec dapibus sem non risus placerat viverra. Etiam nec tortor nisl. Vivamus congue eleifend feugiat. Donec quis felis metus, consectetur bibendum ipsum. Proin auctor sollicitudin diam in elementum. Fusce vel justo in erat viverra tincidunt."
100181,BBB,489000,11/16/2011,3/18/2013,In mollis nisl id nunc vulputate in lacinia libero scelerisque.,"Nunc molestie dignissim imperdiet. Aenean et felis felis. Quisque ligula nisl, ultrices ut elementum at, eleifend in tellus. Aenean felis nibh, blandit a pretium nec, ullamcorper at ligula. Duis elementum venenatis gravida. Donec molestie nulla ut nisl convallis dignissim. Vivamus porttitor nisl eget tellus feugiat non aliquet leo tempus."
100182,ABC,676000,11/30/2011,3/21/2013,In nec purus nec dolor rutrum pharetra.,"Quisque euismod libero quis nulla bibendum rutrum. Nam justo eros, vulputate nec porta ac, porttitor sed mauris. Pellentesque id risus elit. Cras consectetur tincidunt odio, nec porta orci auctor eget. Donec vulputate convallis fringilla. Morbi ullamcorper pellentesque urna, at dictum mauris pretium a. Ut a ultricies felis. Nullam ac mi dui. Cras condimentum diam vel arcu pellentesque aliquam. Praesent placerat lectus ac orci semper sit amet eleifend est elementum. Suspendisse nec lacus dolor. Fusce sollicitudin semper volutpat."
100183,Dept of Education,946000,12/14/2011,3/28/2013,In non lacus id justo porttitor aliquam at eget massa.,"Etiam nisl nibh, posuere vel auctor sed, ornare eget ante. Vestibulum hendrerit adipiscing ante, non rutrum tellus iaculis at. Duis dictum vestibulum posuere. Cras convallis ultricies mi, sit amet pharetra nulla suscipit vel. Pellentesque tristique, quam sit amet dapibus tempus, ipsum libero dapibus lorem, quis pulvinar nisi lacus ac dui. Praesent at quam arcu. Donec at sollicitudin metus. Vivamus vitae felis sit amet enim lacinia fermentum. Donec placerat adipiscing turpis ac pretium. Curabitur vel gravida lorem. Vestibulum ante ipsum primis in faucibus orci luctus et ultrices posuere cubilia Curae; Cras nec auctor ante."
100184,Dept of Education,766000,1/25/2012,6/4/2013,In rutrum leo eu libero tincidunt eleifend.,"Mauris ut ante vel mi consequat feugiat. Sed odio magna, commodo ut mattis eu, pellentesque quis lacus. Nullam varius pulvinar dignissim. Sed augue nunc, luctus id pharetra tincidunt, accumsan ut metus. Fusce venenatis accumsan sapien, vel vehicula lectus pellentesque et. Vivamus quis nisi vitae ligula sodales molestie ut nec arcu. Integer sollicitudin mi nec ligula feugiat a iaculis purus accumsan. Sed lobortis, sem ut vehicula fringilla, nisi arcu dictum nisi, eget egestas tellus felis ac leo. Pellentesque feugiat, libero a accumsan eleifend, neque velit consectetur dolor, eget iaculis lacus est sed elit. Class aptent taciti sociosqu ad litora torquent per conubia nostra, per inceptos himenaeos. Morbi congue eros adipiscing lectus lobortis bibendum. Vestibulum ante ipsum primis in faucibus orci luctus et ultrices posuere cubilia Curae; In et justo sed lorem consequat eleifend eget eu nisl. Morbi aliquam, lectus ut commodo pharetra, massa ligula convallis lectus, ac rutrum felis risus et elit. Etiam mollis orci nec lectus accumsan dapibus."
100185,Dept of Education,2000,2/9/2012,6/14/2013,In sed lectus et lorem varius mattis eu vel diam.,"Sed enim lacus, lacinia vel porta quis, feugiat sit amet lorem. Nunc egestas congue ligula, non laoreet justo semper eget. Pellentesque ut quam sit amet libero ultricies vehicula a sit amet est. Quisque elementum luctus tempus. In vehicula nunc id sapien bibendum iaculis ut sed magna. Cras risus urna, fringilla quis tincidunt vel, scelerisque quis justo. Donec nulla risus, aliquet sed lobortis a, faucibus id mauris. Aliquam erat volutpat. In non tristique lacus. Suspendisse ac nunc lectus. Phasellus eleifend scelerisque urna, rhoncus cursus sem consectetur nec."
100186,Dept of Education,62000,2/13/2012,6/19/2013,In sodales urna sit amet dui pretium commodo.,"Morbi ornare vehicula augue eget elementum. Vestibulum ante ipsum primis in faucibus orci luctus et ultrices posuere cubilia Curae; Nunc sit amet lorem vitae justo ullamcorper consectetur. Morbi libero dolor, ultricies id imperdiet sit amet, elementum ut felis. Phasellus aliquet laoreet sagittis. Nullam congue convallis elit at lacinia. Morbi commodo enim non risus fermentum ultricies. Aliquam erat volutpat. Cras non neque vitae urna luctus lacinia. Nunc laoreet augue et lectus tempus blandit. In hac habitasse platea dictumst. Pellentesque velit velit, ornare eu ullamcorper sed, porttitor sit amet diam."
100187,EFG,299000,1/9/2006,6/21/2013,"In tempor facilisis augue, et ultricies magna placerat a.","Nunc ipsum nibh, consequat a tempus et, pharetra in mauris. Integer pharetra mollis nibh, sit amet ultricies magna gravida sit amet. Duis facilisis magna in lacus ultricies molestie. Aliquam at diam ac neque congue volutpat eget et leo. Nam porta rutrum magna. In hac habitasse platea dictumst. Nam at purus eros, a consectetur sem. Praesent congue suscipit magna, quis euismod erat porttitor sit amet. Nam pulvinar, arcu nec hendrerit malesuada, metus dolor placerat arcu, et viverra metus nisi eget nunc. Phasellus aliquet nibh eget neque ullamcorper posuere."
100188,Dept of Education,903000,1/26/2006,8/14/2013,In ut neque vel justo euismod tincidunt nec et quam.,"Nunc nec nisl auctor tellus hendrerit suscipit. Donec tincidunt enim quis nulla tincidunt aliquam. In in justo a neque rutrum pellentesque sit amet eu lorem. In hac habitasse platea dictumst. Donec id augue vel urna ultrices feugiat ut vel ante. Vivamus scelerisque neque in felis sodales interdum. Maecenas a leo orci, a rutrum nisl. Donec et aliquet est. Morbi tincidunt molestie sapien in viverra. Aliquam eu augue id felis faucibus tempor et quis felis. Aenean augue tortor, facilisis quis gravida eget, blandit id nulla."
100189,BBB,137000,3/29/2006,8/27/2013,In vel lectus id sapien hendrerit eleifend.,"Nunc aliquam lacus ac nisl ornare rhoncus. Vivamus at urna odio. Duis dui dolor, tempus eu porta sit amet, gravida nec lacus. Etiam sagittis, diam ut hendrerit porttitor, nibh magna rhoncus purus, et semper purus ante ut metus. Quisque in mi a metus tempor ultricies vitae id justo. Nulla tortor nisl, scelerisque a facilisis vel, sagittis vel ipsum. Cras pretium dui at felis porttitor sed suscipit urna tincidunt. Quisque vehicula libero sed augue dapibus pellentesque. Proin gravida diam vel nisl iaculis id faucibus diam imperdiet. Donec in nisl eget nisi rhoncus elementum nec blandit metus. Mauris volutpat sagittis velit ut tristique. Aliquam malesuada ornare rhoncus."
100190,ABC,119000,3/30/2006,9/3/2013,Integer a dui quis ipsum blandit porta.,"Etiam tristique sollicitudin pretium. Sed eu metus risus, consectetur rutrum enim. Nulla sollicitudin erat sed neque eleifend adipiscing. Aliquam erat volutpat. Quisque interdum interdum sapien eu scelerisque. Nulla feugiat lorem vitae orci ullamcorper pharetra. Phasellus sodales, ligula nec malesuada suscipit, nulla justo fermentum nisl, imperdiet condimentum libero ante id lectus. Sed condimentum, massa in lobortis porta, sem massa fermentum nunc, sit amet vehicula ligula lectus sit amet sem. In hac habitasse platea dictumst. Integer consectetur eros sed ipsum malesuada non vehicula elit egestas. Duis fermentum tortor eget diam condimentum vitae consectetur nibh dictum. Nunc suscipit dignissim dui fringilla dapibus. Sed eget nulla ac leo tincidunt volutpat vel ac lacus. Duis id neque risus. Mauris lacinia lorem id ante dapibus faucibus."
100191,DDD,195000,6/23/2006,9/17/2013,Integer ac diam id magna dapibus dignissim non at ante.,"Nunc ut hendrerit justo. Nulla ac tortor augue. Aliquam erat volutpat. Morbi felis nisl, scelerisque nec laoreet facilisis, volutpat id enim. Maecenas sollicitudin pulvinar justo vitae pellentesque. Aenean at orci non ligula suscipit consectetur ut in orci. Vivamus sit amet tortor eget odio ultrices sollicitudin. Sed nisi lorem, laoreet eget egestas nec, elementum ut odio. Quisque sit amet velit eget tortor luctus congue. Aenean leo est, posuere at convallis eu, ullamcorper sed dolor. Nulla eu lorem at justo tempor interdum ut ac dui. Pellentesque eu ligula tellus. In sit amet libero urna. Pellentesque faucibus pharetra lectus, a sagittis est dapibus ut. Phasellus mauris sem, vehicula vitae ullamcorper vel, vulputate ac augue. Morbi sit amet massa in nulla consectetur blandit vitae eu risus."
100192,NSF,712000,1/9/2006,10/2/2013,Integer ac lorem vitae odio vestibulum fringilla.,"Aenean tincidunt dui a diam dictum rhoncus. Integer elit sapien, varius vel mattis ut, sagittis at leo. Fusce adipiscing vehicula dolor, nec euismod neque consectetur volutpat. In hac habitasse platea dictumst. Aenean sit amet odio velit, at sodales augue. Sed ut felis in odio volutpat placerat at quis enim. Phasellus auctor accumsan elit, ac laoreet lectus volutpat ac. Aliquam fermentum, mi sed eleifend sagittis, lectus lorem pulvinar ligula, sed tincidunt enim lectus a nisi."
100193,BBB,332000,1/26/2006,12/4/2013,"Integer bibendum semper dolor, quis tincidunt ipsum posuere at.","Duis sagittis molestie ipsum sit amet consequat. Nam lacus ante, molestie iaculis suscipit ac, molestie id augue. Aliquam sem mi, mollis ut ullamcorper et, cursus et sem. Morbi nec fermentum nunc. Nullam ac lectus lectus. Sed bibendum, felis sit amet ornare ornare, tortor augue consequat tellus, at scelerisque odio quam quis ante. Vestibulum ac orci vel lectus venenatis convallis ultricies vel ipsum. Praesent suscipit accumsan nulla et rhoncus. Nulla facilisi. Donec blandit porta placerat. Maecenas non ipsum ut augue ultricies venenatis. Integer sed lorem tortor, eget fringilla leo."
100194,EFG,650000,3/29/2006,12/20/2013,"Integer blandit porttitor sapien, ut vulputate magna congue ut.","Phasellus felis tortor, pretium id porttitor id, laoreet ac lorem. Sed in metus sed nisl gravida hendrerit vitae vitae tortor. Nunc fermentum lacinia tincidunt. Curabitur sed sapien ut quam fringilla pharetra nec ac nibh. Donec in massa nulla, vel adipiscing lacus. Quisque in nunc sit amet ipsum tristique euismod. Maecenas eget orci enim. Fusce nisi est, semper eget semper in, congue vel massa. Vestibulum quis neque sed urna tincidunt lacinia sit amet a mi. Cras urna augue, dapibus ac ornare a, auctor vel velit. Mauris in sem quis est ullamcorper lacinia. Fusce pharetra neque eget nibh facilisis in molestie diam egestas. Fusce gravida auctor ante, eget bibendum elit viverra sed. Donec adipiscing condimentum urna sit amet aliquam. Mauris eget nibh sit amet nisi viverra aliquet."
100195,Dept of Education,25000,3/30/2006,12/24/2013,Integer et nulla at mauris scelerisque pharetra sit amet nec neque.,"Maecenas sed enim est. Aenean orci justo, tempor a pellentesque ut, accumsan nec nunc. Praesent at quam quis mi molestie hendrerit. Nunc suscipit tristique euismod. In non mi vel est vulputate porttitor. Proin eu sapien ligula, sit amet ultricies sem. Quisque euismod est id dolor gravida vestibulum. Proin eu elit erat. Vivamus nunc nulla, facilisis ultrices blandit non, pulvinar et augue. Cras vestibulum scelerisque adipiscing. Cras viverra odio sit amet odio mollis cursus. Sed vel augue tortor. Morbi accumsan posuere purus non feugiat. Integer volutpat lectus et lorem egestas venenatis. Donec pharetra laoreet dictum. Morbi aliquam magna at lacus elementum fringilla."
100196,BBB,915000,6/23/2006,1/21/2014,"Integer et nulla risus, a ullamcorper tellus.","Proin nec est a ligula tempor congue. Mauris metus tellus, ultrices at volutpat sit amet, ultrices sit amet elit. Proin blandit molestie odio, eu eleifend sapien bibendum ut. Nunc ac nisl vel quam luctus suscipit et at velit. Integer ac erat urna. Praesent in sagittis urna. Phasellus accumsan, sapien ut hendrerit mollis, purus lacus aliquet est, vitae egestas elit metus sed erat. In ante nunc, tristique vel interdum sed, molestie ac elit. Aenean pulvinar neque ut mi condimentum molestie. Cras ut odio quis mauris accumsan mattis sed rhoncus libero. Etiam nec scelerisque enim. In eu est turpis. Maecenas luctus nisl quis massa facilisis fermentum. Aliquam erat volutpat. Phasellus sit amet dui mi, et tempor risus. Praesent aliquam hendrerit velit id tempor."
100197,ABC,519000,10/10/2006,4/17/2014,Integer feugiat ligula non nulla luctus quis eleifend arcu congue.,"Mauris et elit eget nisl iaculis gravida quis nec elit. Nullam elementum nisi quis lacus porttitor et ultricies magna interdum. Phasellus dictum facilisis lectus facilisis elementum. Ut quis sem in dui lacinia feugiat. Nulla posuere placerat consequat. Nunc eu dolor et odio condimentum feugiat sed vel mi. Nulla ultrices congue condimentum. Pellentesque tortor augue, consequat in ultricies eget, malesuada eget elit. Sed id tellus ac lorem dignissim semper. Aliquam non tellus in odio posuere tincidunt vulputate eu ante."
100198,DDD,702000,12/7/2006,4/18/2014,Integer in magna nec risus viverra tempor.,"Duis id eros risus, in ultricies sapien. Quisque ornare nibh id turpis lobortis non facilisis tellus fringilla. Cras accumsan lobortis leo, id viverra justo egestas eu. Donec rutrum blandit ante, at ornare mauris ultricies id. Vivamus ultrices leo a leo aliquam sit amet euismod mauris rutrum. Aliquam eu gravida diam. Donec venenatis aliquet placerat."
100199,NSF,548000,2/7/2007,4/23/2014,Integer in tortor at lectus laoreet aliquam.,"Vestibulum pharetra orci sed nunc fermentum at tincidunt est gravida. Proin sit amet erat ac nisl tempor aliquet a in tellus. In tincidunt ultrices sem, et scelerisque elit pretium non. Pellentesque et rutrum nibh. Etiam non odio turpis, quis laoreet velit. Aliquam tempus dolor et ipsum malesuada laoreet. Lorem ipsum dolor sit amet, consectetur adipiscing elit. Nullam lectus metus, egestas at euismod sed, pharetra ac dolor. Suspendisse a erat nibh, in egestas ligula. Aenean id tellus ligula. Aenean ullamcorper facilisis blandit. Pellentesque posuere tempus iaculis. Phasellus eget lectus dui."
100200,BBB,621000,2/19/2007,5/29/2014,Integer non enim ac arcu blandit vulputate.,"Sed erat elit, pulvinar vel condimentum sed, dignissim eu sapien. Nulla facilisi. Pellentesque eu odio id elit convallis mollis. Nullam vel risus at sapien vehicula molestie non eget nibh. Mauris et erat facilisis augue congue scelerisque. Curabitur non augue leo. Curabitur consectetur sagittis sem, a malesuada tellus pulvinar ac. Etiam at nibh vitae lorem imperdiet volutpat. Curabitur ac erat et nibh bibendum gravida accumsan et eros. Mauris vitae massa dui, ac tincidunt ipsum. Nullam ante eros, pretium in scelerisque porttitor, dapibus at neque. Praesent imperdiet dui eu neque mollis ut porta arcu porttitor. Aliquam faucibus ultrices tempus. Nulla mi nisi, convallis eget tristique facilisis, fringilla sit amet dolor. Curabitur tortor lorem, ornare nec blandit sit amet, congue ut orci."
100201,DDD,52000,2/20/2007,6/23/2014,Integer porta ante consequat sem ultrices vel auctor libero tristique.,"Vestibulum ante ipsum primis in faucibus orci luctus et ultrices posuere cubilia Curae; Sed vehicula libero sit amet nunc lobortis vitae lacinia lectus aliquam. Nam purus nisi, ultrices ut malesuada a, ullamcorper nec velit. Mauris vel odio diam, quis dictum ante. Nam sem erat, tincidunt vitae posuere eu, euismod ac nulla. Suspendisse potenti. Aliquam pretium diam erat, sit amet suscipit orci. Nulla commodo sapien a lectus vulputate tincidunt. Maecenas eu nulla augue. Praesent dui quam, blandit in venenatis vitae, gravida et erat. Quisque sagittis volutpat mi, eu aliquam felis bibendum tempus. Pellentesque habitant morbi tristique senectus et netus et malesuada fames ac turpis egestas. Aliquam erat volutpat. Donec orci libero, congue nec vehicula fermentum, gravida ut elit. Quisque aliquet quam at enim faucibus vestibulum."
100202,EFG,305000,3/19/2007,7/1/2014,"Integer sed turpis tortor, quis suscipit elit.","Fusce sit amet dolor id urna porta volutpat in id est. Praesent at vestibulum mi. Fusce a metus tortor, eu commodo nulla. Aenean commodo nisl ac risus gravida at suscipit leo tincidunt. Donec ac elit quis dolor tempus venenatis. Quisque porttitor libero sit amet enim congue a fermentum turpis semper. Pellentesque viverra, tortor nec fringilla egestas, est lorem interdum velit, eget porttitor nulla arcu eu velit. Morbi venenatis congue nisi ac vestibulum. Mauris at metus urna. Sed turpis magna, tristique et ultrices sit amet, volutpat vel lacus. Vestibulum ante ipsum primis in faucibus orci luctus et ultrices posuere cubilia Curae; Nam pellentesque quam lobortis erat interdum eu vulputate ligula sollicitudin. Nullam eleifend facilisis nunc. Aliquam erat volutpat. Donec vestibulum malesuada ligula, mattis condimentum libero tincidunt sed."
100203,Dept of Education,246000,4/20/2007,7/22/2014,Integer tincidunt eros ac lorem mollis facilisis.,"Duis lobortis consectetur urna eu eleifend. Cum sociis natoque penatibus et magnis dis parturient montes, nascetur ridiculus mus. Duis ultrices, velit in elementum accumsan, purus dolor vehicula elit, ac tristique risus tortor sit amet leo. Maecenas vehicula enim a quam faucibus sit amet hendrerit ligula posuere. Mauris elementum sem quis metus rhoncus ac interdum velit gravida. Nulla scelerisque hendrerit tellus, pretium tincidunt enim mattis et. Nunc blandit, ligula vitae iaculis blandit, mauris ligula auctor ante, eget ornare nibh nisl quis dui. Morbi sed sapien arcu, eget dignissim dui. Phasellus ultricies pulvinar felis, vel malesuada nulla adipiscing ac. Vivamus molestie, ipsum at sagittis vulputate, nisl ante lobortis purus, eu imperdiet justo nulla sed quam. Vivamus dignissim quam augue. Cras nisi dolor, aliquam non feugiat et, tincidunt in enim. Nunc condimentum faucibus leo convallis consequat. Fusce elit leo, lacinia in ornare ut, vehicula non sapien. Maecenas at sodales augue. Integer ac tellus turpis."
100204,BBB,333000,5/9/2007,9/23/2014,Integer ullamcorper nunc sit amet nisl vehicula bibendum.,"Quisque ullamcorper lobortis pellentesque. Vestibulum ante ipsum primis in faucibus orci luctus et ultrices posuere cubilia Curae; Pellentesque nulla arcu, scelerisque lacinia ullamcorper id, ultricies vitae nisl. Curabitur vestibulum, tellus vel porttitor lacinia, eros lacus porttitor enim, a cursus est massa posuere tellus. Etiam in odio at augue ornare commodo. Nullam dolor lacus, aliquam at laoreet at, volutpat lobortis purus. Duis at sem tristique dui interdum auctor. Sed fermentum sem in urna viverra ut pellentesque nunc ullamcorper. Nunc fringilla nisl id lectus sodales ut luctus urna sollicitudin."
100205,BBB,807000,9/5/2007,10/29/2014,"Maecenas a dui purus, eget commodo libero.","Mauris ac arcu sit amet urna consectetur sollicitudin. Sed eu nulla quis felis volutpat scelerisque nec interdum neque. Sed sagittis augue vel sem congue quis tincidunt diam dictum. Sed a neque nec nulla eleifend tincidunt a ut erat. Nunc hendrerit lectus at orci mollis placerat. Praesent laoreet ultrices libero, at ultrices urna ultricies at. Vestibulum accumsan lorem id mi tempor rutrum. Mauris quis sapien nulla, ac porta turpis. Duis tincidunt odio at ligula congue bibendum. Etiam ornare interdum leo, convallis volutpat sapien ullamcorper in. Fusce fringilla risus eu felis pulvinar nec auctor nisi tempus. Aenean massa eros, rhoncus eu varius id, feugiat non dui. Fusce vel purus a magna vestibulum interdum non sit amet magna."
