grant_id,funding.agency,funding.amount,date.start,date.end,title,abstract
100240,EFG,14000,8/21/2008,3/8/2012,"Morbi at urna lacus, eget ullamcorper risus.","Integer quis orci nibh. Aliquam ut nulla massa, eu cursus justo. Maecenas vel malesuada quam. Mauris viverra fermentum orci, laoreet tempor odio lobortis sit amet. Cras tellus dui, auctor at blandit eu, interdum eu nunc. Fusce volutpat sapien at nunc iaculis ac consectetur tortor eleifend. Nullam in lectus ac sem placerat hendrerit."
100241,Dept of Education,76000,11/5/2008,3/30/2012,Morbi eleifend ante sit amet ligula tincidunt sollicitudin.,"Mauris at nulla vel erat facilisis aliquam. Proin pellentesque dolor et tortor rutrum semper. Cum sociis natoque penatibus et magnis dis parturient montes, nascetur ridiculus mus. Cum sociis natoque penatibus et magnis dis parturient montes, nascetur ridiculus mus. Pellentesque a lacus est. Sed pretium auctor eleifend. In non sapien tempus nisi sodales placerat. Sed adipiscing justo sed massa elementum sit amet tincidunt urna dictum. Etiam consectetur lobortis leo. Quisque ultrices pretium arcu, ut ultricies purus egestas eu. Suspendisse enim est, commodo quis viverra ultricies, imperdiet id purus. Vestibulum tempor feugiat mattis. Sed sem nunc, aliquet nec tempus quis, lacinia in nibh. Nulla nec augue est. In a posuere elit."
100242,BBB,23000,11/26/2008,5/29/2012,Morbi eleifend erat nec nunc adipiscing accumsan.,"Vestibulum a suscipit dolor. Nullam sodales egestas orci vel tristique. Vivamus ultricies feugiat varius. Class aptent taciti sociosqu ad litora torquent per conubia nostra, per inceptos himenaeos. Lorem ipsum dolor sit amet, consectetur adipiscing elit. Proin in arcu urna, nec tempus nisl. Sed dignissim quam et quam feugiat cursus quis eget lorem."
100243,BBB,20000,12/16/2008,6/11/2012,Morbi et justo id lorem consectetur ullamcorper eu ac enim.,"Sed ligula urna, varius quis adipiscing vel, tristique eu odio. Curabitur pellentesque cursus facilisis. Donec fermentum neque eu eros congue non varius tellus faucibus. Quisque malesuada turpis et ipsum aliquet tempor. Morbi id sem nisl. Nulla ut eros neque, eu posuere purus. In hac habitasse platea dictumst. Ut aliquam, tortor non egestas gravida, purus lacus tristique enim, eu semper massa urna et risus. Aliquam velit velit, rhoncus ac sodales sed, vestibulum at ipsum. Sed aliquam lectus vitae nisl ultrices accumsan. Aenean at justo mollis odio posuere commodo. Fusce diam mauris, aliquet et mollis vitae, sollicitudin nec turpis."
100244,ABC,4000,12/25/2008,8/22/2012,"Morbi facilisis volutpat orci, sed lobortis turpis dapibus sit amet.","Pellentesque sit amet quam porttitor urna eleifend venenatis. Morbi lacinia odio consectetur risus mollis sodales. Nunc a metus at tortor malesuada dapibus. Morbi rutrum laoreet aliquet. Donec dignissim, lorem id ultrices mattis, tortor erat adipiscing erat, eu consequat ligula magna nec neque. Duis at felis justo. Nullam aliquam aliquet arcu non pellentesque. Pellentesque habitant morbi tristique senectus et netus et malesuada fames ac turpis egestas. Phasellus felis urna, placerat vitae consequat id, posuere vitae neque. Morbi vulputate ligula vitae nibh aliquet vitae condimentum nisl bibendum. Morbi rhoncus massa ac ipsum commodo scelerisque. Quisque elit enim, pulvinar ac tempor non, porttitor a ipsum. Vestibulum auctor tincidunt lacinia. Suspendisse potenti."
100245,Dept of Education,29000,5/19/2009,9/10/2012,Morbi mattis tellus sed eros tristique eu vulputate tortor tempus.,"Nunc eu velit dolor. Integer volutpat adipiscing tempor. Praesent blandit nisi aliquam velit molestie bibendum. Quisque luctus ipsum sit amet libero sodales eget aliquet felis posuere. Proin metus purus, cursus non auctor in, interdum sit amet mi. Cum sociis natoque penatibus et magnis dis parturient montes, nascetur ridiculus mus. Pellentesque eget erat purus. Mauris vel placerat odio. Proin mauris justo, convallis eget tempus non, facilisis vitae nisl. Sed hendrerit accumsan purus in facilisis. Etiam ut massa eu tortor vulputate vestibulum vitae in turpis. Phasellus blandit congue purus id mattis. Sed facilisis velit non justo bibendum et commodo lorem sagittis. Integer vel urna at eros rhoncus mollis a vel nunc. Integer venenatis interdum luctus. Suspendisse in nisi vel lectus egestas commodo sit amet nec ipsum."
100246,Dept of Education,33000,6/15/2009,9/11/2012,Morbi nec tellus in arcu dignissim pulvinar.,"Suspendisse tristique tincidunt nunc sodales blandit. Sed vitae diam lectus. Suspendisse potenti. Proin at purus vitae augue aliquam tempus ac eu tellus. Vestibulum adipiscing suscipit tortor vitae tempor. Curabitur ultrices accumsan nisi consectetur dictum. Nunc placerat velit sit amet quam bibendum nec dapibus tellus posuere. Duis non elit vitae dolor fermentum bibendum. Integer vehicula quam id ligula commodo lacinia in a felis. Morbi nisi felis, ornare a pretium vitae, feugiat vel sapien. Phasellus nisi ante, viverra in condimentum sit amet, cursus vitae tortor. Integer sed pulvinar nulla. Vestibulum ante sapien, pharetra vitae laoreet in, dignissim eu erat. Pellentesque semper, lorem eu aliquam fermentum, tortor lectus accumsan quam, eu rutrum erat leo ut ligula. Vivamus nibh erat, accumsan at faucibus non, posuere sed turpis. Pellentesque nec nulla velit."
100247,Dept of Education,9000,7/15/2009,9/26/2012,Morbi non dui sit amet enim tincidunt hendrerit.,"Vestibulum ante ipsum primis in faucibus orci luctus et ultrices posuere cubilia Curae; Sed eros urna, vehicula ultricies volutpat non, egestas eu leo. Nulla nec diam augue, ut suscipit massa. In ultricies neque nec dui sodales gravida iaculis enim iaculis. Sed placerat, erat sed porttitor vulputate, nisi nibh ultricies ipsum, eu elementum nibh libero vel sem. Aliquam erat volutpat. Donec eu mauris odio, non tempor nunc. In nibh massa, convallis in mattis blandit, lobortis sit amet sapien. Vivamus pretium ultricies urna. Mauris varius viverra justo, nec mollis ipsum aliquam a. Ut sed neque massa. Suspendisse volutpat lorem a felis tincidunt commodo. Praesent auctor augue eleifend leo faucibus condimentum. Sed a mi eget nisl laoreet fermentum in eget sapien. Nulla vitae tincidunt nibh. Nunc hendrerit consectetur sem sed auctor."
100248,DDD,55000,1/26/2006,10/8/2012,Morbi rhoncus nulla sit amet mauris iaculis eleifend.,Curabitur dictum bibendum tincidunt. Quisque id fringilla justo. Suspendisse gravida metus diam. Curabitur blandit mi dolor. Donec volutpat commodo rhoncus. Morbi in tortor vel risus facilisis lacinia ut volutpat lectus. Quisque non dignissim ipsum.
100249,NSF,20000,3/29/2006,10/19/2012,Morbi sed lacus in sem viverra cursus.,"Etiam pellentesque nibh sit amet neque tempus tempor. Maecenas auctor tristique neque, nec congue lacus tristique ut. In lobortis mauris eu massa imperdiet ac tempus nunc congue. Duis a tristique libero. Duis faucibus tristique leo, a faucibus purus dignissim consectetur. Nullam vel euismod justo. Nam ante magna, condimentum sed gravida malesuada, semper vitae eros. Proin at metus eu nunc ultrices pretium."
100250,BBB,14000,3/30/2006,11/5/2012,"Morbi sit amet tortor tortor, ut ultricies libero.","Vestibulum quis elit vel purus rhoncus semper vel sit amet leo. Duis tempus erat et libero sagittis blandit. Aliquam ultricies bibendum accumsan. Integer vel orci felis, sed hendrerit lacus. Nullam neque neque, hendrerit at dignissim quis, posuere sit amet velit. Nam justo nibh, interdum quis tempor vel, aliquam pharetra eros. Vestibulum ante ipsum primis in faucibus orci luctus et ultrices posuere cubilia Curae; Proin volutpat, tortor nec bibendum pulvinar, purus velit rutrum nisi, lobortis consectetur tellus turpis eu metus. In accumsan libero ac leo blandit vel lacinia metus aliquet."
100251,EFG,40000,6/23/2006,11/20/2012,"Morbi suscipit sodales tellus, id convallis risus luctus nec.","Vivamus velit eros, fringilla vel accumsan ac, auctor vitae urna. Nam faucibus nulla nec elit consectetur interdum. Donec eu metus magna, vel pretium urna. Fusce id nunc in magna congue hendrerit faucibus quis sem. Praesent elementum malesuada justo, ut adipiscing mi tristique eu. Nulla tincidunt bibendum metus, quis porta quam ultricies ac. Vivamus lacus urna, placerat id sodales eu, tincidunt vel enim. Nam sem eros, egestas nec placerat in, varius at dolor. Sed placerat lobortis sem, sed hendrerit mi vulputate ut. Morbi urna leo, imperdiet eget lacinia id, vulputate in tellus. Ut pellentesque eros in nisl varius non tincidunt nisl tempor. Aenean dignissim ipsum congue arcu posuere vestibulum."
100252,Dept of Education,30000,10/10/2006,11/30/2012,Morbi tempor mi porttitor ipsum accumsan eget consequat urna congue.,"Etiam laoreet arcu at mi lacinia id vestibulum massa vulputate. Vestibulum ante ipsum primis in faucibus orci luctus et ultrices posuere cubilia Curae; Nam et turpis vel massa tincidunt bibendum ut eget metus. Morbi vitae lorem ante, vel ornare erat. Etiam ut ligula sit amet nibh malesuada aliquet sit amet a justo. Lorem ipsum dolor sit amet, consectetur adipiscing elit. Maecenas egestas volutpat dapibus. Sed placerat iaculis augue. Phasellus ligula erat, rhoncus nec faucibus vel, cursus a magna. Nulla ornare, mi at convallis hendrerit, lacus justo elementum augue, non sodales felis massa ac lacus. Nam interdum tempus ante, vitae consectetur sem imperdiet non. Class aptent taciti sociosqu ad litora torquent per conubia nostra, per inceptos himenaeos."
100253,BBB,40000,12/7/2006,12/27/2012,"Morbi ullamcorper gravida ante, id varius velit suscipit vitae.","Nunc at massa lorem. Sed eu sem quis risus aliquet egestas. Aenean quis augue ac eros faucibus pulvinar at a velit. In hac habitasse platea dictumst. Cras pretium hendrerit est vel posuere. Sed mollis porta erat ut volutpat. Proin egestas, nibh eu egestas lacinia, dolor metus ultricies risus, quis malesuada risus magna vitae orci. Vivamus quis lorem varius velit congue pellentesque."
100254,ABC,99000,2/7/2007,1/29/2015,Nam a eros in orci scelerisque bibendum condimentum porta est.,"Integer imperdiet neque a felis eleifend blandit. Lorem ipsum dolor sit amet, consectetur adipiscing elit. Etiam at tellus quam. Suspendisse sit amet dolor mauris, et mattis nibh. Maecenas fringilla lorem ac nisi sagittis imperdiet. Integer ultricies tempus orci, porttitor tincidunt nisi congue rutrum. Nulla facilisi. Nulla laoreet porttitor mi ut iaculis. Pellentesque sed ante sagittis nibh sodales viverra. Donec turpis neque, euismod sit amet faucibus quis, vulputate ut sem. Maecenas faucibus pharetra libero a semper. Nullam mauris est, condimentum in vehicula a, luctus at sapien. Donec vulputate convallis posuere. Etiam quis sapien tellus."
100255,DDD,7000,2/19/2007,7/28/2015,Nam ac arcu vel nisi luctus eleifend.,"Nunc ullamcorper elit at nisl pretium sodales. Nunc varius porta velit, ultricies bibendum nunc tempor hendrerit. Cras auctor porta arcu, in varius ligula consequat eu. Vestibulum ante ipsum primis in faucibus orci luctus et ultrices posuere cubilia Curae; Sed euismod vestibulum nunc vitae hendrerit. Sed elementum velit vitae nibh cursus at mollis orci consectetur. Nulla quam enim, sollicitudin sit amet convallis fermentum, placerat non nisl. Integer non felis id sem interdum luctus ut sed felis."
100256,NSF,78000,2/20/2007,10/7/2015,"Nam at erat nibh, quis lobortis nisl.","Aliquam iaculis cursus libero, vel volutpat justo ultricies et. Fusce at orci ut eros dignissim fringilla. Etiam pretium ipsum id leo elementum vehicula. Vestibulum ornare, felis at laoreet ultricies, leo augue posuere augue, ac volutpat magna velit nec enim. Aliquam risus velit, varius vel sollicitudin a, dapibus at tellus. Donec ac nulla eu ligula blandit scelerisque. Suspendisse pellentesque porttitor odio, luctus gravida magna imperdiet consectetur. Aliquam erat volutpat. Aliquam sit amet est at nisi egestas ornare. Pellentesque tortor purus, rhoncus id vehicula eu, rhoncus et dolor. Etiam ut tellus diam. Nullam in orci arcu. Morbi odio quam, sodales quis consectetur id, cursus at risus. Nulla neque sapien, rhoncus eget sodales et, aliquet id massa."
100257,BBB,53000,3/19/2007,11/25/2015,"Nam consequat dignissim metus, eu tempor ipsum gravida quis.","Nulla facilisi. Aliquam ut diam mi. In ut diam in neque fringilla gravida a non neque. Nam faucibus felis nibh. Cras scelerisque pharetra mauris non fermentum. Vestibulum purus ligula, lobortis at fringilla id, sodales a lectus. Donec ante elit, interdum eget eleifend sit amet, semper in risus. Morbi congue, lectus ut malesuada dictum, metus ante convallis sapien, sit amet eleifend augue urna sed massa. Donec arcu nulla, iaculis quis aliquet id, fermentum ac massa. Sed vitae mauris nunc, in dignissim ipsum. Donec non risus nisi, vitae consectetur dui."
100258,DDD,73000,4/20/2007,12/7/2015,Nam faucibus orci eu nisl aliquam eleifend quis ac dolor.,"Nulla varius aliquam ornare. Sed consequat nibh eget ante tempus non sagittis leo suscipit. Integer pretium ornare est, nec suscipit leo lobortis et. Donec posuere lacinia tortor, sit amet scelerisque metus congue ut. Quisque libero libero, volutpat ut bibendum at, pellentesque in risus. Mauris consequat ante sed augue dignissim mattis. Sed eu augue lorem, eget malesuada tellus. Nunc tristique elementum rutrum. Phasellus pretium, nibh ut posuere semper, turpis sapien imperdiet ligula, id adipiscing diam eros quis mauris. Maecenas a est non neque pharetra posuere. Phasellus ante risus, sagittis nec pulvinar id, consequat at ligula. Fusce sed varius leo. Mauris tempus nisi sit amet elit sollicitudin fringilla. Morbi urna urna, suscipit ut vestibulum non, pulvinar eu lacus. Donec non sem ipsum."
100259,EFG,50000,5/9/2007,2/18/2016,Nam feugiat risus id mauris facilisis mattis.,"Maecenas eget nulla mi. Phasellus quis nisi sed ipsum tincidunt ultricies adipiscing non turpis. Pellentesque habitant morbi tristique senectus et netus et malesuada fames ac turpis egestas. Cras vel luctus urna. Suspendisse dignissim, velit sit amet rutrum malesuada, est massa sodales mauris, at aliquam massa purus ac ipsum. Nulla facilisi. Proin id ipsum turpis. Sed dolor massa, venenatis eu feugiat vel, aliquet quis metus. Mauris placerat sagittis convallis. Aenean vitae justo quam, nec suscipit mi. Pellentesque est magna, malesuada in viverra ut, aliquam sit amet leo."
100260,Dept of Education,60000,9/5/2007,3/10/2016,Nam fringilla nulla feugiat magna suscipit convallis.,"Praesent aliquet consectetur condimentum. Donec non urna purus, egestas posuere erat. Sed adipiscing faucibus odio, nec faucibus erat eleifend vel. Nam vestibulum rutrum lacus nec luctus. Proin dictum condimentum massa nec ultrices. Vestibulum sit amet lectus id est sollicitudin viverra nec ultricies libero. Proin purus lorem, sodales sed volutpat eget, pulvinar et velit. Vivamus faucibus, erat eget gravida molestie, enim lorem lacinia neque, a sagittis dui neque nec diam. Integer in felis id erat lobortis luctus in in nibh."
100261,BBB,18000,9/14/2007,3/11/2016,Nam id nunc nec erat commodo tempor at id orci.,"Sed leo ipsum, molestie et venenatis in, adipiscing quis nibh. Nulla facilisi. Quisque non neque purus. Donec euismod sapien sed metus luctus eget laoreet ligula tempus. Aenean ut ligula quis nulla ornare molestie non bibendum erat. Ut elementum leo et velit dictum porttitor. Cras vestibulum libero varius tortor semper dapibus. Curabitur rhoncus ultricies turpis eget convallis. Aenean turpis lectus, fermentum ut lacinia tempor, dictum eget ipsum. Etiam tincidunt convallis pulvinar. Nulla at lacinia arcu."
100262,BBB,39000,9/25/2007,4/21/2016,Nam id risus id felis blandit semper.,"Nullam congue, ipsum eget ornare vestibulum, nisi enim tempor elit, eget elementum neque enim nec orci. Integer consequat nulla vel est egestas sollicitudin. Quisque elit nunc, fermentum vel feugiat et, dapibus vel purus. Donec mollis arcu eleifend nulla auctor commodo. Mauris tempus purus at velit dapibus ultricies. Vestibulum ante ipsum primis in faucibus orci luctus et ultrices posuere cubilia Curae; Aenean eros turpis, pharetra eget semper vel, posuere in turpis. Vestibulum vitae orci at est bibendum auctor et a purus. Morbi magna ipsum, rutrum eu consectetur ac, ultricies et ligula. Praesent in ligula id ipsum aliquet sagittis. Phasellus congue feugiat lectus, in pulvinar diam ultricies eget. Cras volutpat consectetur nibh, vitae imperdiet quam facilisis aliquam. Sed in mi ut justo interdum facilisis in sed nulla."
100263,ABC,42000,6/6/2008,6/3/2016,Nam pulvinar augue et nisi auctor quis lobortis mi gravida.,"Sed non nulla et dolor porttitor viverra. Aliquam blandit mauris ligula, sit amet tincidunt sem. Proin molestie lacus elementum risus faucibus iaculis consequat est hendrerit. Mauris consequat vehicula lobortis. Integer vulputate vulputate ante quis tempor. Aenean et purus ut massa blandit consectetur. Maecenas rhoncus rhoncus elementum. Pellentesque habitant morbi tristique senectus et netus et malesuada fames ac turpis egestas."
100264,Dept of Education,9000,6/19/2008,6/23/2016,Nam sit amet erat sit amet quam sodales malesuada.,"Vivamus id elit quis urna interdum faucibus. Vestibulum massa tellus, ultricies quis sollicitudin non, mollis nec risus. Phasellus ut ultrices neque. Sed commodo nisi nibh, eget blandit dolor. Donec condimentum nisl non turpis interdum auctor. Vestibulum et lorem nisi. Mauris accumsan urna eu nisi imperdiet elementum. Duis tincidunt velit eget sem faucibus eu suscipit metus viverra. Sed vel sapien sed erat aliquet feugiat. Donec sollicitudin nisi et eros vehicula vel venenatis lorem pellentesque. In sed velit id nibh scelerisque mattis. Ut lorem orci, elementum eget tristique ut, lacinia eu est."
100265,Dept of Education,72000,8/21/2008,7/11/2016,Nam tristique nulla nec dui scelerisque non facilisis ligula accumsan.,"Maecenas volutpat mollis nisl non dapibus. Praesent a arcu risus, sit amet sagittis nulla. Fusce eget sem sit amet diam congue ultricies aliquet eu diam. Nunc ac placerat mauris. Nulla congue erat nec enim rutrum ultricies. Sed eu volutpat massa. Nulla auctor velit arcu, sit amet ullamcorper ligula. Ut turpis augue, dictum non molestie ac, tempor ac eros."
100266,Dept of Education,10000,11/5/2008,7/19/2016,Nam ultrices purus in ante bibendum elementum.,"Class aptent taciti sociosqu ad litora torquent per conubia nostra, per inceptos himenaeos. Sed mollis metus libero, ac iaculis purus. Maecenas malesuada rutrum risus in lobortis. Suspendisse tincidunt porta lacus, non fermentum dui molestie et. Maecenas suscipit nulla a purus suscipit sollicitudin eget eget lacus. Suspendisse dictum, libero eget pellentesque blandit, ipsum est pulvinar sem, eu vulputate sem dolor ut mi. Morbi pharetra, leo id ornare euismod, lacus arcu aliquam neque, id blandit felis urna at libero. Aenean at aliquam urna. Praesent ultrices velit non massa porta eget laoreet nibh placerat. In et dui enim, id pulvinar risus. Curabitur porta imperdiet volutpat. Maecenas venenatis massa sit amet metus ornare id imperdiet justo scelerisque. Quisque lacinia, dui id convallis scelerisque, ipsum nunc porttitor eros, a facilisis magna eros sit amet ipsum. Proin imperdiet vestibulum urna, id interdum nibh faucibus sit amet."
100267,DDD,17000,11/26/2008,7/22/2016,Nam vel lectus id nibh bibendum egestas.,"Sed aliquam pellentesque venenatis. Lorem ipsum dolor sit amet, consectetur adipiscing elit. Donec sit amet eros vel odio sollicitudin ultrices. Pellentesque a diam mi, ut pulvinar libero. Proin dignissim libero vel nulla luctus vulputate tristique turpis vestibulum. Fusce posuere lacinia elit id sodales. Integer at felis eu magna ultricies accumsan. Proin urna tellus, venenatis a accumsan at, pharetra blandit metus. Nam bibendum risus vel turpis suscipit a pellentesque felis viverra. Donec est risus, bibendum posuere lobortis ac, rutrum id arcu. Vestibulum ante ipsum primis in faucibus orci luctus et ultrices posuere cubilia Curae; Vestibulum feugiat eleifend nulla, vitae sagittis sapien accumsan quis. Sed vel libero dolor, eu suscipit neque. Proin sagittis massa non sem commodo non congue velit lobortis. Phasellus volutpat pulvinar sem, vel fermentum felis volutpat non. Etiam placerat tincidunt ipsum sed vestibulum."
100268,NSF,24000,12/16/2008,9/15/2016,"Nam vitae felis sem, non laoreet tortor.","Vestibulum nisl urna, dictum aliquet tristique eget, lobortis sit amet libero. Maecenas id vulputate eros. Nam tempor enim ultrices magna imperdiet vestibulum. Integer molestie velit vel dui viverra tincidunt. Suspendisse bibendum rutrum nulla sit amet molestie. Duis id aliquet justo. Duis vitae est nisl, in eleifend est. Suspendisse erat dolor, porttitor et blandit vitae, consectetur a ligula. Sed vitae libero eu arcu tristique aliquet eget a sem."
100269,BBB,1000,12/25/2008,10/13/2016,Nam viverra tellus nec lacus elementum in tincidunt magna porttitor.,"Duis mi sapien, aliquet vel pellentesque vel, tempor ac turpis. Suspendisse magna turpis, dictum a cursus sed, ultricies a urna. In hac habitasse platea dictumst. Curabitur porta, ante in venenatis mollis, dui sapien tincidunt odio, at dictum urna metus in lacus. In hac habitasse platea dictumst. Suspendisse pulvinar consectetur dui, et porta velit pulvinar id. Duis scelerisque leo ut enim aliquam interdum. Cras pretium massa at leo vestibulum in bibendum urna feugiat. Donec interdum vehicula erat at auctor."
100270,EFG,92000,5/19/2009,11/24/2016,Nulla a arcu pellentesque turpis ornare rutrum.,"Nullam tempus gravida risus non pretium. Nulla tempor ultrices nibh, interdum laoreet nulla consequat in. Duis vestibulum lectus nec metus condimentum quis interdum leo imperdiet. Vivamus laoreet eros a enim condimentum posuere. Ut ut risus risus. Nullam dolor quam, cursus elementum tincidunt et, bibendum sit amet risus. Proin mi urna, ultrices id hendrerit sed, vestibulum egestas ligula. Praesent sed dolor massa, suscipit commodo massa. Pellentesque sagittis faucibus tortor eget interdum. Integer sit amet odio urna. Quisque rhoncus, dui eu elementum cursus, sem leo lacinia lectus, eu rutrum nunc nisl sed magna. Nulla placerat mollis justo, quis vestibulum diam porta id. Mauris et turpis vitae tellus mattis volutpat non quis felis. Sed nisi metus, sollicitudin non imperdiet id, convallis id arcu. Sed porttitor ornare lorem eget lacinia."
100271,Dept of Education,15000,6/15/2009,11/25/2016,Nulla bibendum ipsum quis risus aliquet luctus.,"Ut commodo sem felis. Donec id imperdiet sapien. Quisque erat elit, consequat non dignissim vel, consectetur a eros. Sed at massa leo. Nunc auctor venenatis augue, eget bibendum nunc rhoncus et. Aenean at commodo turpis. Nulla venenatis, mi id porta lobortis, dolor tellus ullamcorper nulla, auctor vehicula diam velit non tortor. Mauris pellentesque quam nec quam euismod eget condimentum nisi rutrum. Quisque turpis mauris, congue in ultricies sed, laoreet vitae arcu. Lorem ipsum dolor sit amet, consectetur adipiscing elit."
100272,BBB,29000,7/15/2009,11/30/2016,"Nulla consectetur mollis massa, at auctor dolor lobortis a.","Aenean faucibus sem non erat eleifend imperdiet. Proin aliquet vestibulum lectus a ultrices. Ut nec nibh sit amet metus varius consectetur. Class aptent taciti sociosqu ad litora torquent per conubia nostra, per inceptos himenaeos. Curabitur eget mauris ipsum, vehicula vehicula lectus. Mauris massa nisl, elementum eget tincidunt a, iaculis nec quam. Nam ac quam ac nunc scelerisque dignissim nec vel odio. Donec sed tellus nisi, vitae congue neque. Phasellus purus leo, sagittis sed auctor eget, gravida in libero. In quis mattis quam."
100273,ABC,65000,1/26/2006,12/1/2016,Nulla egestas mi at elit facilisis sagittis.,"Nam eu sapien erat. Morbi congue luctus dui id scelerisque. Nulla elit enim, tempus vitae condimentum semper, vulputate eu velit. Suspendisse elit sem, volutpat at aliquam ut, eleifend sed nisl. Sed a odio felis, in fermentum ante. Quisque laoreet tristique metus, viverra dictum massa condimentum ac. Fusce ultricies mauris non neque consequat bibendum. Sed mattis libero adipiscing eros tristique vel commodo ligula lacinia. Sed nec diam in tellus malesuada sagittis. Maecenas mattis erat sit amet lorem gravida pharetra. Mauris eget augue sed felis vulputate viverra. Nulla facilisi. Etiam mattis fringilla leo. Cras sed nisl enim. Aenean quis dolor magna."
100274,DDD,31000,3/29/2006,12/28/2016,Nulla eu augue eu quam tristique gravida.,"Fusce ornare tortor ut arcu porta pellentesque. Ut sapien nunc, cursus id auctor ut, aliquam et nibh. Pellentesque habitant morbi tristique senectus et netus et malesuada fames ac turpis egestas. Donec egestas tortor arcu, vel aliquet elit. Fusce luctus turpis sit amet eros elementum rutrum. Sed volutpat fermentum vulputate. Morbi sit amet mi at diam congue ultricies."
100275,NSF,26000,3/30/2006,1/13/2017,"Nulla iaculis suscipit libero, id posuere dui volutpat a.","Ut at tellus neque. Nam sed tortor ante, faucibus posuere purus. Suspendisse vehicula, sapien vel dictum aliquam, libero mi ornare ipsum, vel consequat orci augue sit amet dui. Praesent ut eros non urna posuere laoreet. Donec interdum luctus mauris, vestibulum aliquam turpis vehicula in. Etiam egestas sagittis odio quis viverra. Nulla consequat leo quis nulla rutrum at dictum est faucibus. Curabitur in eros velit. Proin enim risus, bibendum sit amet auctor vitae, ultrices ac sem. Nunc semper, elit in fringilla cursus, metus augue elementum neque, nec egestas erat arcu a magna. Nulla facilisi. Vivamus convallis venenatis nisi ut dapibus. Sed ornare elementum feugiat."
